{
  "schemaVersion": 1,
  "planCode": "PROFISSIONAL",
  "version": "1.0.0",
  "displayName": "Thalya Profissional",
  "limits": {
    "agents": 2,
    "channels": 2,
    "monthlyConversations": 1500,
    "knowledgeDocuments": 100,
    "monthlyAudioMinutes": 300,
    "monthlyTechnicalHours": 3,
    "customIntegrations": 0
  },
  "features": {
    "text": true,
    "stt": true,
    "tts": true,
    "calendar": true,
    "drive": true,
    "followUp": true,
    "asaas": false,
    "customIntegrations": false,
    "loadTest": false
  },
  "delivery": {
    "support": "Prioritário",
    "adjustmentRounds": 3,
    "commitmentMonths": 6,
    "reporting": "operational"
  },
  "acceptance": [
    "Todos os critérios do Essencial validados",
    "Transcrição e resposta em áudio validadas",
    "Agenda e regras de disponibilidade validadas",
    "Google Drive validado",
    "Follow-ups validados em modo de teste",
    "Até dois canais validados conforme contrato"
  ]
}

